{"clockAuthorityRevision":"panshi.clock-authority.synthetic-conformance.2026-09","contractVersion":"fact-manifest/v1","evidenceCutoffAt":"2026-07-21T10:00:00Z","finalityPolicyRevision":"panshi.finality-policy.synthetic-conformance.2026-09","interactionCutoffAt":"2026-07-21T05:30:00Z","interactionFactRevisionIds":["sf_20260721_settle_1301_r1","sf_20260721_settle_2317_r1","sf_20260721_settle_2330_r1","sf_20260721_settle_2454_r1","sf_20260721_settle_2603_r1","sf_20260721_tag_1301_r1","sf_20260721_tag_2317_r1","sf_20260721_tag_2330_r1","sf_20260721_tag_2454_r1","sf_20260721_tag_2603_r1"],"interactionFactSetDigest":"sha256:2ef96f6669dd361cbdb98a8b7d9f9af5de5f32d4637ae1235572ea09908bc950","jurisdiction":"TW","licenseClass":"panshi.sealed-market-facts.tw.synthetic-conformance","manifestHash":"sha256:8b092431149f3fb95729bde4a507144059fbc12c5f9f54ca26ff62e59b972978","manifestId":"fm_20260721_r1_2ef96f6669dd","marketCalendarRevision":"twse.regular-session.synthetic-conformance.2026-09","marketDateTaipei":"2026-07-21","marketSessionId":"mkts_tw_20260721_regular","modeDomain":"historical","objectHash":"sha256:bc7411a5d066fc8d9f4596b03db3c847372d7ed17a69de24f22949b717b9b5a3","objectUri":"https://panshi.nomadsustaintech.com/contracts/fact-manifest/fixtures/v0.1.0/2026-07-21/bundle.v1.json","outcomeEvidenceRevisionIds":["sf_20260721_evidence_1301_r1","sf_20260721_evidence_2317_r1","sf_20260721_evidence_2330_r1","sf_20260721_evidence_2454_r1","sf_20260721_evidence_2603_r1"],"outcomeEvidenceSetDigest":"sha256:abe36f70633a48096ed1366b31c932be01a7cd87de291b313c5b64b7925b720f","permittedPurposes":["sealed_world_state_ingest","paper_outcome_settlement"],"rightsManifestId":"rights_panshi_conformance_synthetic_2026_09","rightsValidFrom":"2026-07-01T00:00:00Z","rightsValidUntil":null,"sealedAt":"2026-07-21T12:00:00Z","signatureKeyId":"panshi-conformance-synthetic-signing-2026-09"}