{"clockAuthorityRevision":"panshi.clock-authority.synthetic-conformance.2026-09","contractVersion":"fact-manifest/v1","evidenceCutoffAt":"2026-07-22T10:00:00Z","finalityPolicyRevision":"panshi.finality-policy.synthetic-conformance.2026-09","interactionCutoffAt":"2026-07-22T05:30:00Z","interactionFactRevisionIds":["sf_20260722_natal_2330_r1","sf_20260722_settle_1301_r1","sf_20260722_settle_2317_r1","sf_20260722_settle_2330_r1","sf_20260722_settle_2603_r1","sf_20260722_settle_6488_r1","sf_20260722_tag_1301_r1","sf_20260722_tag_2317_r1","sf_20260722_tag_2330_r1","sf_20260722_tag_2603_r1","sf_20260722_tag_6488_r1"],"interactionFactSetDigest":"sha256:48ab2b52b5181e2ceb419bd4c714eb0890f42388325548584914e06258528441","jurisdiction":"TW","licenseClass":"panshi.sealed-market-facts.tw.synthetic-conformance","manifestHash":"sha256:4ac49c9a4a3382102197677eb8ae6556783e617dbff8d0296b3e2718c712f684","manifestId":"fm_20260722_r1_48ab2b52b518","marketCalendarRevision":"twse.regular-session.synthetic-conformance.2026-09","marketDateTaipei":"2026-07-22","marketSessionId":"mkts_tw_20260722_regular","modeDomain":"historical","objectHash":"sha256:4b936dc3bb8dffb4a98f0985011a46adde9081423de84ce3f1bf9ca383b659c2","objectUri":"https://panshi.nomadsustaintech.com/contracts/fact-manifest/fixtures/v0.1.0/2026-07-22/bundle.v1.json","outcomeEvidenceRevisionIds":["sf_20260722_evidence_1301_r1","sf_20260722_evidence_2317_r1","sf_20260722_evidence_2330_r1","sf_20260722_evidence_2603_r1","sf_20260722_evidence_6488_r1"],"outcomeEvidenceSetDigest":"sha256:60ff95738688280e7abfb16fb5b7cc3ddbd733f981afaa9d683399ed5c909b03","permittedPurposes":["sealed_world_state_ingest","paper_outcome_settlement"],"rightsManifestId":"rights_panshi_conformance_synthetic_2026_09","rightsValidFrom":"2026-07-01T00:00:00Z","rightsValidUntil":"2027-07-01T00:00:00Z","sealedAt":"2026-07-22T12:00:00Z","signatureKeyId":"panshi-conformance-synthetic-signing-2026-09"}