{"clockAuthorityRevision":"panshi.clock-authority.synthetic-conformance.2026-09","contractVersion":"fact-manifest/v1","evidenceCutoffAt":"2026-07-23T10:00:00Z","finalityPolicyRevision":"panshi.finality-policy.synthetic-conformance.2026-09","interactionCutoffAt":"2026-07-23T05:30:00Z","interactionFactRevisionIds":["sf_20260723_natal_2330_r1","sf_20260723_settle_1301_r1","sf_20260723_settle_2317_r1","sf_20260723_settle_2330_r1","sf_20260723_settle_2454_r1","sf_20260723_settle_2603_r1","sf_20260723_tag_1301_r1","sf_20260723_tag_2317_r1","sf_20260723_tag_2330_r1","sf_20260723_tag_2454_r1","sf_20260723_tag_2603_r1"],"interactionFactSetDigest":"sha256:9ee75024babd4e454a4578a9b66b44abbe3a1eda9554046bb9006e2100f879c5","jurisdiction":"TW","licenseClass":"panshi.sealed-market-facts.tw.synthetic-conformance","manifestHash":"sha256:82084ed99e3470d1a5bbbe2f8374e335dadd3fd5a1a742f69090957492275983","manifestId":"fm_20260723_r1_9ee75024babd","marketCalendarRevision":"twse.regular-session.synthetic-conformance.2026-09","marketDateTaipei":"2026-07-23","marketSessionId":"mkts_tw_20260723_regular","modeDomain":"historical","objectHash":"sha256:c5dea4df0d6360b94bb2a7057b065998ca55986ccbfe3d3f89825e8b6d9febad","objectUri":"https://panshi.nomadsustaintech.com/contracts/fact-manifest/fixtures/v0.1.0/2026-07-23/bundle.v1.json","outcomeEvidenceRevisionIds":[],"outcomeEvidenceSetDigest":"sha256:e3b0c44298fc1c149afbf4c8996fb92427ae41e4649b934ca495991b7852b855","permittedPurposes":["sealed_world_state_ingest","paper_outcome_settlement"],"rightsManifestId":"rights_panshi_conformance_synthetic_2026_09","rightsValidFrom":"2026-07-01T00:00:00Z","rightsValidUntil":"2027-07-01T00:00:00Z","sealedAt":"2026-07-23T12:00:00Z","signatureKeyId":"panshi-conformance-synthetic-signing-2026-09"}