{"clockAuthorityRevision":"panshi.clock-authority.synthetic-conformance.2026-09","contractVersion":"fact-manifest/v1","evidenceCutoffAt":"2026-07-24T10:00:00Z","finalityPolicyRevision":"panshi.finality-policy.synthetic-conformance.2026-09","interactionCutoffAt":"2026-07-24T05:30:00Z","interactionFactRevisionIds":["sf_20260724_natal_2317_r1","sf_20260724_natal_2330_r1","sf_20260724_settle_1301_r1","sf_20260724_settle_2317_r1","sf_20260724_settle_2330_r1","sf_20260724_settle_2454_r1","sf_20260724_settle_2603_r1","sf_20260724_tag_1301_r1","sf_20260724_tag_2317_r1","sf_20260724_tag_2330_r1","sf_20260724_tag_2454_r1","sf_20260724_tag_2603_r1"],"interactionFactSetDigest":"sha256:6293a325dd8d47b5d3257193b5429f60553dfceaba2c86f6f4cb5853641bdfdd","jurisdiction":"TW","licenseClass":"panshi.sealed-market-facts.tw.synthetic-conformance","manifestHash":"sha256:b3cfa54bf30142892d2d0e038539198c2e817c842d565ce20f63809c97c2527d","manifestId":"fm_20260724_r1_6293a325dd8d","marketCalendarRevision":"twse.regular-session.synthetic-conformance.2026-09","marketDateTaipei":"2026-07-24","marketSessionId":"mkts_tw_20260724_regular","modeDomain":"historical","objectHash":"sha256:96c910c330bb8b39e22be133293ab3b7b4e067268c297cf90dab68f296cf4d3e","objectUri":"https://panshi.nomadsustaintech.com/contracts/fact-manifest/fixtures/v0.1.0/2026-07-24/bundle.v1.json","outcomeEvidenceRevisionIds":["sf_20260724_evidence_1301_r1","sf_20260724_evidence_2317_r1","sf_20260724_evidence_2330_r1","sf_20260724_evidence_2454_r1","sf_20260724_evidence_2603_r1"],"outcomeEvidenceSetDigest":"sha256:3ec728620c1e867ae5d1a1c48d60372d4df99984893af6a203e5ef27d3a8ef22","permittedPurposes":["sealed_world_state_ingest","paper_outcome_settlement"],"rightsManifestId":"rights_panshi_conformance_synthetic_2026_09","rightsValidFrom":"2026-07-01T00:00:00Z","rightsValidUntil":"2027-07-01T00:00:00Z","sealedAt":"2026-07-24T12:00:00Z","signatureKeyId":"panshi-conformance-synthetic-signing-2026-09"}