{"clockAuthorityRevision":"panshi.clock-authority.synthetic-conformance.2026-09","contractVersion":"fact-manifest/v1","evidenceCutoffAt":"2026-07-22T10:00:00Z","finalityPolicyRevision":"panshi.finality-policy.synthetic-conformance.2026-09","interactionCutoffAt":"2026-07-22T05:30:00Z","interactionFactRevisionIds":["sf_20260722_natal_2330_r2","sf_20260722_settle_1301_r2","sf_20260722_settle_2317_r2","sf_20260722_settle_2330_r2","sf_20260722_settle_2603_r2","sf_20260722_settle_6488_r2","sf_20260722_tag_1301_r2","sf_20260722_tag_2317_r2","sf_20260722_tag_2330_r2","sf_20260722_tag_2603_r2","sf_20260722_tag_6488_r2"],"interactionFactSetDigest":"sha256:627572451f8de87c0b91fe3c270666e4fe45b224f276de5a978776bc1d1a74c6","jurisdiction":"TW","licenseClass":"panshi.sealed-market-facts.tw.synthetic-conformance","manifestHash":"sha256:662e5b6486407a7ae56d8e2533279f761dc51f984ef55865c807feb65908a2fe","manifestId":"fm_20260722_r2_627572451f8d","marketCalendarRevision":"twse.regular-session.synthetic-conformance.2026-09","marketDateTaipei":"2026-07-22","marketSessionId":"mkts_tw_20260722_regular","modeDomain":"historical","objectHash":"sha256:7d5b5c1f7af6a55569d325b81576cceeb26ed49e0d1e4d3f9f000b5bf793a670","objectUri":"https://panshi.nomadsustaintech.com/contracts/fact-manifest/fixtures/v0.1.0/2026-07-22/bundle.v1.r2.json","outcomeEvidenceRevisionIds":["sf_20260722_evidence_1301_r2","sf_20260722_evidence_2317_r2","sf_20260722_evidence_2330_r2","sf_20260722_evidence_2603_r2","sf_20260722_evidence_6488_r2"],"outcomeEvidenceSetDigest":"sha256:48eacaab149468c175c6c0f0564917208e189400eb0ae61acff1266a7e3e6cbb","permittedPurposes":["sealed_world_state_ingest","paper_outcome_settlement"],"rightsManifestId":"rights_panshi_conformance_synthetic_2026_09","rightsValidFrom":"2026-07-01T00:00:00Z","rightsValidUntil":"2027-07-01T00:00:00Z","sealedAt":"2026-07-22T18:00:00Z","signatureKeyId":"panshi-conformance-synthetic-signing-2026-09"}